{
  "$schema": "https://json-schema.org/draft/2020-12/schema",
  "$id": "https://kavach.local/schemas/cve_exploit_input.schema.json",
  "title": "KAVACH CVE / 0-day Exploit Input",
  "description": "Structured vulnerability intelligence required for LLM-driven exploit generation against authorized targets. Designed for new CVEs and 0-days without NVD/PoC availability.",
  "type": "object",
  "required": [
    "schema_version",
    "identification",
    "vulnerability",
    "attack_surface",
    "verification"
  ],
  "additionalProperties": false,
  "properties": {
    "schema_version": {
      "type": "string",
      "const": "1.0",
      "description": "Schema version for forward compatibility."
    },
    "identification": {
      "type": "object",
      "required": ["id", "disclosure_status"],
      "additionalProperties": false,
      "properties": {
        "id": {
          "type": "string",
          "minLength": 3,
          "description": "CVE-YYYY-NNNNN or internal 0-day id (e.g. ZDI-2026-001, KAVACH-ZDAY-001)."
        },
        "aliases": {
          "type": "array",
          "items": { "type": "string" },
          "description": "Alternate names (vendor IDs, GHSA, etc.)."
        },
        "title": { "type": "string" },
        "disclosure_status": {
          "type": "string",
          "enum": ["0day", "embargoed", "public"]
        },
        "severity": {
          "type": "string",
          "enum": ["CRITICAL", "HIGH", "MEDIUM", "LOW", "UNKNOWN"]
        },
        "cvss_score": { "type": "number", "minimum": 0, "maximum": 10 },
        "cvss_vector": { "type": "string" },
        "cwe_ids": {
          "type": "array",
          "items": { "type": "string", "pattern": "^CWE-[0-9]+$" }
        }
      }
    },
    "vulnerability": {
      "type": "object",
      "required": ["description", "root_cause", "vulnerability_class"],
      "additionalProperties": false,
      "properties": {
        "description": {
          "type": "string",
          "minLength": 20,
          "description": "What is broken and why it matters."
        },
        "root_cause": {
          "type": "string",
          "minLength": 10,
          "description": "Precise technical root cause (sink, missing validation, logic bug)."
        },
        "vulnerability_class": {
          "type": "string",
          "minLength": 3,
          "description": "e.g. OS Command Injection, JNDI Lookup, SSTI, Deserialization."
        },
        "attack_scenario": {
          "type": "string",
          "description": "Step-by-step attacker narrative (no live-target URLs)."
        },
        "primitives": {
          "type": "array",
          "minItems": 1,
          "items": {
            "type": "object",
            "required": ["name", "description"],
            "additionalProperties": false,
            "properties": {
              "name": { "type": "string" },
              "description": { "type": "string" },
              "location": { "type": "string" },
              "sink_type": {
                "type": "string",
                "description": "e.g. os_command, jndi_lookup, sql_query, template_eval."
              },
              "confidence": { "type": "number", "minimum": 0, "maximum": 1 }
            }
          }
        }
      }
    },
    "affected_software": {
      "type": "object",
      "additionalProperties": false,
      "properties": {
        "products": { "type": "array", "items": { "type": "string" } },
        "vulnerable_versions": { "type": "array", "items": { "type": "string" } },
        "fixed_versions": { "type": "array", "items": { "type": "string" } },
        "repo_url": { "type": "string" },
        "commit_vulnerable": { "type": "string" },
        "commit_patched": { "type": "string" }
      }
    },
    "attack_surface": {
      "type": "object",
      "required": ["protocol", "endpoints"],
      "additionalProperties": false,
      "properties": {
        "protocol": {
          "type": "string",
          "enum": ["http", "https", "tcp", "tls", "udp", "other"]
        },
        "base_urls": {
          "type": "array",
          "items": { "type": "string", "format": "uri" },
          "description": "Authorized base URLs (loopback/lab only unless allowlisted)."
        },
        "endpoints": {
          "type": "array",
          "minItems": 1,
          "items": {
            "type": "object",
            "required": ["path", "methods"],
            "additionalProperties": false,
            "properties": {
              "path": { "type": "string", "pattern": "^/" },
              "methods": {
                "type": "array",
                "minItems": 1,
                "items": { "type": "string", "enum": ["GET", "POST", "PUT", "PATCH", "DELETE", "HEAD", "OPTIONS"] }
              },
              "auth_required": { "type": "boolean" },
              "auth_type": {
                "type": "string",
                "enum": ["none", "basic", "bearer", "cookie", "custom"]
              },
              "auth_credentials": {
                "type": "object",
                "additionalProperties": { "type": "string" },
                "description": "Lab credentials only — never production secrets."
              },
              "parameters": {
                "type": "array",
                "items": {
                  "type": "object",
                  "required": ["name", "location", "controllable"],
                  "additionalProperties": false,
                  "properties": {
                    "name": { "type": "string" },
                    "location": {
                      "type": "string",
                      "enum": ["query", "path", "header", "cookie", "body", "json_field", "xml_field", "multipart"]
                    },
                    "type": { "type": "string" },
                    "required": { "type": "boolean" },
                    "controllable": { "type": "boolean" },
                    "description": { "type": "string" },
                    "example_benign": { "type": "string" },
                    "encoding_notes": { "type": "string" }
                  }
                }
              },
              "body_format": {
                "type": "string",
                "enum": ["json", "xml", "form", "raw", "multipart", "none"]
              },
              "body_schema": { "type": "object" },
              "content_type": { "type": "string" }
            }
          }
        },
        "callback": {
          "type": "object",
          "additionalProperties": false,
          "properties": {
            "required": { "type": "boolean" },
            "type": {
              "type": "string",
              "enum": ["http", "ldap", "dns", "rmi", "other"]
            },
            "listener_host": { "type": "string" },
            "listener_port": { "type": "integer" },
            "description": { "type": "string" }
          }
        }
      }
    },
    "source_artifacts": {
      "type": "object",
      "additionalProperties": false,
      "properties": {
        "patch_diff": { "type": "string" },
        "vulnerable_code_snippets": {
          "type": "array",
          "items": {
            "type": "object",
            "required": ["file", "content"],
            "properties": {
              "file": { "type": "string" },
              "language": { "type": "string" },
              "content": { "type": "string" },
              "line_start": { "type": "integer" }
            }
          }
        },
        "patched_code_snippets": {
          "type": "array",
          "items": {
            "type": "object",
            "required": ["file", "content"],
            "properties": {
              "file": { "type": "string" },
              "language": { "type": "string" },
              "content": { "type": "string" }
            }
          }
        },
        "stack_trace": { "type": "string" },
        "crash_dump": { "type": "string" }
      }
    },
    "verification": {
      "type": "object",
      "required": ["flag", "success_signals"],
      "additionalProperties": false,
      "properties": {
        "flag": {
          "type": "object",
          "required": ["format", "location_type"],
          "additionalProperties": false,
          "properties": {
            "format": {
              "type": "string",
              "description": "Pattern e.g. KAVACH_FLAG{...} or FLAG_[hex]."
            },
            "value": {
              "type": "string",
              "description": "Planted secret in the lab (required for auto-verification)."
            },
            "location_type": {
              "type": "string",
              "enum": [
                "environment_variable",
                "file",
                "database",
                "http_response",
                "rce_output",
                "callback_proof"
              ]
            },
            "location_detail": { "type": "string" },
            "capture_marker": {
              "type": "object",
              "additionalProperties": false,
              "properties": {
                "prefix": { "type": "string" },
                "suffix": { "type": "string" }
              }
            }
          }
        },
        "success_signals": {
          "type": "array",
          "minItems": 1,
          "items": {
            "type": "object",
            "required": ["type"],
            "additionalProperties": false,
            "properties": {
              "type": {
                "type": "string",
                "enum": [
                  "response_body_contains",
                  "response_header_contains",
                  "http_status",
                  "callback_received",
                  "file_contents_match",
                  "shell_output"
                ]
              },
              "pattern": { "type": "string" },
              "code": { "type": "integer" },
              "description": { "type": "string" }
            }
          }
        },
        "failure_signals": {
          "type": "array",
          "items": {
            "type": "object",
            "required": ["type"],
            "properties": {
              "type": { "type": "string" },
              "pattern": { "type": "string" },
              "code": { "type": "integer" },
              "description": { "type": "string" }
            }
          }
        },
        "patched_verification": {
          "type": "object",
          "additionalProperties": false,
          "properties": {
            "required": { "type": "boolean" },
            "expect_blocked": { "type": "boolean" }
          }
        }
      }
    },
    "authorization": {
      "type": "object",
      "additionalProperties": false,
      "properties": {
        "target_url": {
          "type": "string",
          "format": "uri",
          "description": "Single authorized target base URL."
        },
        "operator_confirms_authorized": { "type": "boolean" },
        "lab_mode": {
          "type": "boolean",
          "description": "Use bundled or operator-provided lab fixture."
        },
        "serve_lab": {
          "type": "boolean",
          "description": "Auto-start vulnerable lab (bundled fixture only today)."
        },
        "lab_fixture": {
          "type": "string",
          "enum": ["command_injection_ping", "custom"],
          "description": "Which local vulnerable fixture to spin up."
        }
      }
    },
    "exploit_hints": {
      "type": "object",
      "additionalProperties": false,
      "properties": {
        "preferred_techniques": {
          "type": "array",
          "items": { "type": "string" }
        },
        "payload_constraints": { "type": "array", "items": { "type": "string" } },
        "payload_suggestions": { "type": "array", "items": { "type": "string" } },
        "avoid": { "type": "array", "items": { "type": "string" } },
        "notes": { "type": "string" }
      }
    },
    "references": {
      "type": "array",
      "items": { "type": "string", "format": "uri" }
    },
    "metadata": {
      "type": "object",
      "additionalProperties": false,
      "properties": {
        "author": { "type": "string" },
        "created_at": { "type": "string" },
        "source": { "type": "string" },
        "notes": { "type": "string" }
      }
    }
  }
}
